{
  "format": "canvas-render-eval-summary-v1",
  "case_id": "comment-agent/nominal",
  "status": "pass",
  "coverage": {
    "events": {
      "expected": 8,
      "captured": 8,
      "complete": true
    },
    "live_checkpoints": {
      "expected": 4,
      "captured": 4,
      "complete": true
    }
  },
  "counts": {
    "actions": 3,
    "captures_ok": 12,
    "captures_failed": 0,
    "assertions": 14,
    "required_failed": 0
  },
  "final": {
    "event_seq": 8,
    "revision": 2,
    "model_hash": "90521c104aa0d702a1cfe14d83c631085474a1da39b85c821771419301a9eb60"
  },
  "timing_ms": {
    "execute": 6148.7708899999925,
    "replay_render": 6267.015958999997,
    "oracles": 0.5255010000037146
  },
  "failures": []
}
